{
  "schema_version": "1.0.0",
  "project_id": "sample_02_dimension_transfer",
  "task_id": "migrate-sample_02_dimension_transfer",
  "story_bible_version": null,
  "evidence": [
    {
      "context_id": "original-source",
      "value": false,
      "source_id": "samples/차원이동.txt",
      "source_type": "retrieval",
      "source_version": "missing",
      "authority": "primary",
      "retrieved_at": "2026-06-20T07:49:18.281950Z",
      "updated_at": "2026-06-20T07:49:18.281950Z",
      "freshness_hours": 0,
      "required": true,
      "status": "missing"
    },
    {
      "context_id": "derived-element-pack",
      "value": "Derived functions may support bounded hypotheses only.",
      "source_id": "projects/sample_independent_loops/sample_02_dimension_transfer/element_pack.json",
      "source_type": "retrieval",
      "source_version": "legacy-overlay-1.14.0",
      "authority": "secondary",
      "retrieved_at": "2026-06-20T07:49:18.281950Z",
      "updated_at": "2026-06-20T07:49:18.281950Z",
      "freshness_hours": 0,
      "required": false,
      "status": "resolved"
    }
  ],
  "conflicts": [],
  "uncertainties": [
    "Original-reference fidelity cannot be scored until the source TXT is restored."
  ],
  "generated_at": "2026-06-20T07:49:18.281950Z"
}