{"schema_version":"1.0.0","project_id":"novel_example","task_id":"draft-ep001","story_bible_version":"0.1.0","evidence":[{"context_id":"canon-current","value":"The protagonist is hiding the ledger.","source_id":"story_bible:canon-001","source_type":"story_bible","source_version":"0.1.0","authority":"canonical","retrieved_at":"2026-06-20T00:00:00Z","updated_at":"2026-06-20T00:00:00Z","freshness_hours":0,"required":true,"status":"resolved"},{"context_id":"character-current","value":"The protagonist distrusts the inspector.","source_id":"character_state:protagonist","source_type":"character_state","source_version":"0.1.0","authority":"canonical","retrieved_at":"2026-06-20T00:00:00Z","updated_at":"2026-06-20T00:00:00Z","freshness_hours":24,"required":true,"status":"resolved"}],"conflicts":[],"uncertainties":[],"generated_at":"2026-06-20T00:00:00Z"}
