{"schema_version":"1.0.0","project_id":"muhan_regression_remake_10","task_id":"draft-episodes-001-010","story_bible_version":"1.0.0","evidence":[{"context_id":"source-primary","value":"User explicitly designated sample/무한회귀.txt as the remake source. Preserve 이한결, 한시연, 모노리스, 무한 회귀, 무회갤, the clear-point extinction contract, and difficulty system while rewriting prose and scene assembly.","source_id":"sample/무한회귀.txt#sha256:3c9a6347465d989a03db4f6eec0ff3c41ba9e680383e1bcd36de3504436365ba","source_type":"retrieval","source_version":"sha256:3c9a6347465d989a03db4f6eec0ff3c41ba9e680383e1bcd36de3504436365ba","authority":"primary","retrieved_at":"2026-06-22T00:00:00Z","updated_at":"2026-06-22T00:00:00Z","freshness_hours":0,"required":true,"status":"resolved"},{"context_id":"canon-current","value":"Story Bible 1.0.0 locks the original protagonist/world and defines the remake-only 10-episode arc without changing core canon.","source_id":"projects/muhan_regression_remake_10/story_bible.json","source_type":"story_bible","source_version":"1.0.0","authority":"canonical","retrieved_at":"2026-06-22T00:00:00Z","updated_at":"2026-06-22T00:00:00Z","freshness_hours":0,"required":true,"status":"resolved"},{"context_id":"serial-plan","value":"Episodes 1-10 progress from apocalypse and first regression through tutorial clear, government contact, first-floor checkpoint, and 한시연 contact.","source_id":"projects/muhan_regression_remake_10/episode_plan_20.json","source_type":"approved_decision","source_version":"1.0.0","authority":"approved","retrieved_at":"2026-06-22T00:00:00Z","updated_at":"2026-06-22T00:00:00Z","freshness_hours":0,"required":true,"status":"resolved"}],"conflicts":[],"uncertainties":["The source TXT has damaged chapter markers, so episode boundaries are remade from stable plot milestones rather than copied mechanically."],"generated_at":"2026-06-22T00:00:00Z"}
